{
  "catalog_context": {
    "coordinate_system": "rendition_media_ms",
    "recording_id": "recording_example_001",
    "rendition_id": "rendition_example_001",
    "source_start_ms": 1800000
  },
  "engine": {
    "build": {
      "configuration": [
        "CMAKE_BUILD_TYPE=Release",
        "CC=/usr/bin/gcc",
        "CXX=/usr/bin/g++",
        "CCACHE_DISABLE=1",
        "GGML_BLAS=OFF",
        "GGML_CUDA=OFF",
        "GGML_NATIVE=ON",
        "GGML_OPENMP=ON",
        "GGML_VULKAN=OFF",
        "WHISPER_FFMPEG=OFF"
      ],
      "repository": "https://github.com/ggml-org/whisper.cpp",
      "revision": "48f628a84833905ee4a0658ee6d4a5c915ce1997",
      "target": "whisper-vad-speech-segments"
    },
    "executable": "/srv/himr-tools/whisper.cpp-v1.8.7/whisper-vad-speech-segments",
    "expected_byte_count": 658912,
    "expected_sha256": "ca7828ddc277c93daf5f356a52e853f0d4964933c2e1f01652924ec9a4e7d39e",
    "profile_id": "whispercpp-vad-speech-segments-v1.8.7-linux-amd64-cpu",
    "version_evidence": "source_revision_plus_executable_sha256",
    "version_label": "whisper.cpp v1.8.7"
  },
  "input": {
    "artifact_id": "artifact_example_normalized_audio_001",
    "expected_byte_count": 12345678,
    "expected_sha256": "1111111111111111111111111111111111111111111111111111111111111111",
    "media_id": "media_sha256_1111111111111111111111111111111111111111111111111111111111111111",
    "parent_processing_run_id": "run_local_window_example_001",
    "path": "/srv/himr-private/audio/example-16khz-mono.flac"
  },
  "job_id": "vad_example_001",
  "model": {
    "expected_byte_count": 885098,
    "expected_sha256": "2aa269b785eeb53a82983a20501ddf7c1d9c48e33ab63a41391ac6c9f7fb6987",
    "license_label": "MIT",
    "model_id": "silero_vad_v6_2_0_ggml",
    "name": "Silero VAD v6.2.0 GGML",
    "path": "/srv/himr-models/ggml-silero-v6.2.0.bin",
    "profile_id": "silero-vad-v6.2.0-ggml",
    "revision": "v6.2.0",
    "source": "https://huggingface.co/ggml-org/whisper-vad/blob/main/ggml-silero-v6.2.0.bin"
  },
  "output": {
    "root": "/srv/himr-private/vad-output"
  },
  "parameters": {
    "max_speech_duration_state": "float_max_default",
    "min_silence_duration_ms": 100,
    "min_speech_duration_ms": 250,
    "parameter_binding": "reviewed_source_defaults_with_broken_cli_fields_omitted_v1",
    "samples_overlap_seconds": 0.1,
    "segmentation_profile": "whispercpp-v1.8.7-silero-v6.2.0-cli-defaults-v1",
    "speech_pad_ms": 30,
    "threads": 1,
    "threshold": 0.5,
    "timeout_seconds": 900,
    "use_gpu": false
  },
  "schema_version": 1
}
